id,title,source_name,source_type,platform,url,published_date,last_seen_date,stance,summary,debate_point,authority_score,popularity_score,recency_score,tags,status,personas,themes
"mines-action-weapons-2026-06-05","AI for All except weapons","Mines Action Canada","advocacy-post","Organization post","https://www.minesactioncanada.org/aiforall","2026-06-05","2026-06-08","negative","Welcomes the domestic focus but argues the strategy would be stronger with guardrails on AI use in defence, security, and weapons.","A public-interest AI strategy may need an explicit military and autonomous weapons boundary, even when the launch focuses on civilian uses.","3.7","2.9","5","defence;weapons;security;guardrails","reviewed","concerned-canadian;future-canada","accountability;canadian-control;who-benefits"
"geist-details-2026-06-04","AI for All, details to follow","Michael Geist","own-post","Blog","https://www.michaelgeist.ca/2026/06/ai-for-all-details-to-follow-government-releases-a-big-spending-ai-strategy-that-is-still-short-on-the-specifics-that-matter/","2026-06-04","2026-06-08","negative","Argues the strategy is ambitious and has useful choices, but defers too many hard policy questions around transparency, privacy, automated decision-making, and enforceable AI rules.","Trust cannot come only from spending, privacy reform, and voluntary certification; Canada may need clearer transparency obligations.","4.9","4.1","4.8","transparency;privacy;regulation;trust","reviewed","concerned-canadian;student;workplace-adopter","whats-real;deepfakes;my-data;accountability;ethics-critical-thinking;accountable-workflows"
"krug-skeptical-guide-2026-06-04","Canada's AI for All strategy: skeptical guide","Kris Krug","own-post","Blog","https://kriskrug.co/2026/06/04/canada-ai-for-all-strategy-skeptical-guide/","2026-06-04","2026-06-08","mixed","Treats the launch as a large economic, workforce, sovereignty, and trust package while tracking where the public should keep asking for receipts.","The strategy is not only a policy promise; it is an ongoing accountability surface for labour, energy, procurement, literacy, and governance.","3.5","3.2","4.8","receipts;labour;energy;procurement;governance","reviewed","future-canada;concerned-canadian;small-business","big-promise;jobs-wages;public-services;who-benefits;environment;accountability;where-to-start;customer-trust"
"betakit-lacks-teeth-2026-06-05","Canada's AI strategy promises to protect citizens. Critics say it still lacks teeth","BetaKit","news-analysis","News","https://betakit.com/canadas-ai-strategy-promises-to-protect-citizens-critics-say-it-still-lacks-teeth/","2026-06-05","2026-06-08","negative","Collects criticism that the protection side of the strategy is still light on concrete child safety, online harms, privacy, and enforcement measures.","The strategy promises protection, but critics want more specific legal duties and remedies.","4.4","4","5","children;online harms;privacy;enforcement","reviewed","concerned-canadian;student","deepfakes;my-kids;my-data;accountability;ethics-critical-thinking"
"linkedin-boger-smb-support-2026-06-05","Canada's AI strategy: regulatory direction and SMB support","Dr Jennifer Boger","social-post","LinkedIn","https://www.linkedin.com/posts/jen-boger_refreshed-national-ai-strategy-to-be-released-activity-7465472184635908096-6CVl","2026-06-05","2026-06-08","mixed","A pre-launch LinkedIn discussion asks for clearer regulatory direction and faster, meaningful support for Canadian SMBs and responsible ecosystem-building.","Small organizations need both adoption support and clarity on responsible use before the strategy becomes practical.","3.6","2.8","5","SMBs;responsible AI;regulation;support","reviewed","small-business;workplace-adopter","where-to-start;can-i-afford-it;customer-trust;training-upskilling;accountable-workflows"
"ap-foreign-dominance-2026-06-04","Carney warns foreign AI platforms can be used against Canadians","Associated Press","news","News","https://apnews.com/article/canada-carney-artificial-intelligence-d8dfba818b84ccf5947f941731829254","2026-06-04","2026-06-08","mixed","Captures the strategy's core sovereignty argument: dependence on foreign platforms creates data, security, economic, and values risks.","Canada is betting that sovereign compute and trusted alliances can reduce dependence on hyperscalers without isolating the country.","4.8","4.6","4.8","sovereignty;foreign platforms;compute;alliances","reviewed","concerned-canadian;entrepreneur;future-canada","canadian-control;my-data;compute-access;global-markets;who-benefits;big-promise"
"cci-scale-canadian-firms-2026-06-04","CCI statement on the federal government's AI strategy","Council of Canadian Innovators","industry-statement","Organization post","https://www.canadianinnovators.org/content/cci-statement-on-the-federal-governments-ai-strategy","2026-06-04","2026-06-08","positive","Welcomes the strategy's focus on Canadian innovators while arguing implementation should be judged by whether Canadian firms scale globally and capture more value.","The pro-strategy case is that Canadian prosperity depends on building firms, IP, and policy capacity at home.","4.3","3.6","4.8","scaleups;IP;economic sovereignty;commercialization","reviewed","entrepreneur;small-business;future-canada","capital-growth;government-customer;ip-and-data;global-markets;sector-opportunity;can-i-afford-it;who-benefits;real-economy"
"global-missing-2026-06-04","Five things missing from Canada's AI strategy","Global News","news-analysis","News","https://globalnews.ca/news/11890433/ai-strategy-canada-whats-missing/","2026-06-04","2026-06-08","negative","Frames public questions around missing timelines, unclear job impacts, data centre implications, and how promises will be delivered.","The launch creates targets, but readers still need timelines, delivery mechanics, labour impact estimates, and infrastructure tradeoffs.","4.2","4.2","4.8","jobs;timelines;data centres;implementation","reviewed","future-canada;workplace-adopter;concerned-canadian","big-promise;jobs-wages;real-economy;who-benefits;will-ai-replace-me;daily-work;environment"
"new-west-implementation-2026-06-04","Understanding Canada's National Artificial Intelligence Strategy","New West Public Affairs","analysis","Firm post","https://www.newwestpublicaffairs.ca/news-insights/aiforall","2026-06-04","2026-06-08","mixed","Highlights implementation questions around trust, funding access, policy coherence, delivery partners, and the capital-intensive sovereign compute buildout.","The strategy's success depends less on the launch document and more on coherent delivery across departments, partners, provinces, and budgets.","3.8","3.1","4.8","implementation;coherence;provinces;compute","reviewed","entrepreneur;future-canada;concerned-canadian","compute-access;capital-growth;government-customer;public-services;big-promise;real-economy;canadian-control;environment"
